{
  "$id": "https://wondersgroup.com/schema/entity/services/connections/testConnectionDefinition.json",
  "$schema": "http://json-schema.org/draft-07/schema#",
  "title": "TestConnectionDefinition",
  "description": "TestConnection is the definition that will encapsulate the steps required to test a connection to a specific service.",
  "type": "object",
  "javaType": "org.umetadata.schema.entity.services.connections.TestConnectionDefinition",
  "javaInterfaces": ["org.umetadata.schema.EntityInterface"],
  "definitions": {
    "testConnectionStep": {
      "description": "Function that tests one specific element of the service. E.g., listing schemas, lineage, or tags.",
      "type": "object",
      "javaType": "org.umetadata.schema.entity.services.connections.TestConnectionStep",
      "properties": {
        "name": {
          "description": "Name of the step being tested",
          "type": "string"
        },
        "description": {
          "description": "What is the goal of the step",
          "type": "string"
        },
        "errorMessage": {
          "description": "In case of error this message should be displayed on UI, We define this message manually on test connection definition",
          "type": "string"
        },
        "mandatory": {
          "description": "Is this step mandatory to be passed?",
          "type": "boolean",
          "default": true
        },
        "shortCircuit": {
          "description": "This field if set to true, indicates that the step is important enough to break the process in case of failure.",
          "type": "boolean",
          "default": false
        }
      },
      "additionalProperties": false,
      "required": ["name", "mandatory", "description"]
    }
  },
  "properties": {
    "id": {
      "description": "Unique identifier of this test case definition instance.",
      "$ref": "../../../type/basic.json#/definitions/uuid"
    },
    "name": {
      "description": "Name of the Test Connection Definition. It should be the `type` of the service being tested, e.g., Mysql, or Snowflake.",
      "$ref": "../../../type/basic.json#/definitions/entityName"
    },
    "displayName": {
      "description": "Display Name that identifies this test definition.",
      "type": "string"
    },
    "description": {
      "description": "Description of the test connection def.",
      "$ref": "../../../type/basic.json#/definitions/markdown"
    },
    "fullyQualifiedName": {
      "description": "FullyQualifiedName same as `name`.",
      "$ref": "../../../type/basic.json#/definitions/fullyQualifiedEntityName"
    },
    "steps": {
      "description": "Steps to test the connection. Order matters.",
      "type": "array",
      "items": {
        "$ref": "#/definitions/testConnectionStep"
      }
    },
    "owners": {
      "description": "Owner of this TestConnection definition.",
      "$ref": "../../../type/entityReferenceList.json",
      "default": null
    },
    "version": {
      "description": "Metadata version of the entity.",
      "$ref": "../../../type/entityHistory.json#/definitions/entityVersion"
    },
    "updatedAt": {
      "description": "Last update time corresponding to the new version of the entity in Unix epoch time milliseconds.",
      "$ref": "../../../type/basic.json#/definitions/timestamp"
    },
    "updatedBy": {
      "description": "User who made the update.",
      "type": "string"
    },
    "impersonatedBy": {
      "description": "Bot user that performed the action on behalf of the actual user.",
      "$ref": "../../../type/basic.json#/definitions/impersonatedBy"
    },
    "href": {
      "description": "Link to the resource corresponding to this entity.",
      "$ref": "../../../type/basic.json#/definitions/href"
    },
    "changeDescription": {
      "description": "Change that lead to this version of the entity.",
      "$ref": "../../../type/entityHistory.json#/definitions/changeDescription"
    },
    "incrementalChangeDescription": {
      "description": "Change that lead to this version of the entity.",
      "$ref": "../../../type/entityHistory.json#/definitions/changeDescription"
    },
    "deleted": {
      "description": "When `true` indicates the entity has been soft deleted.",
      "type": "boolean",
      "default": false
    },
    "domains" : {
      "description": "Domains the asset belongs to. When not set, the asset inherits the domain from the parent it belongs to.",
      "$ref": "../../../type/entityReferenceList.json"
    }
  },
  "additionalProperties": false,
  "required": ["name", "steps"]
}